case_id,analysis_tier_aux,material_proxy_depth_status,associated_engineering_model_depth_m,source_directness_level,source_directness_score,material_identity_level,material_identity_score,boundary_completeness_level,boundary_completeness_score,version_consistency_level,version_consistency_score,coefficient_specificity_level,coefficient_specificity_score,blocking_issue_flag,blocking_issue,eligibility_rule_id,eligibility_result,headline_eligible,source_ids,notes
monopile_15mw,A_core,source_specified,,primary_report,2,whole_mass_material_proxy,1,core_only_missing_scour,1,single_aligned_design,2,generic_material_factor,1,no,,RULE_H1,conditional_headline,yes,NREL75698|WORLDSTEEL_PLATE_2023,Reported foundation mass includes allowances whose material split is unavailable
volturnus_15mw,A_core,source_specified,,primary_report,2,explicit_main_materials,2,missing_anchors_and_interface,1,single_aligned_design,2,generic_material_factors,1,no,,RULE_H1,conditional_headline,yes,NREL76773|WORLDSTEEL_PLATE_2023|MPA_GCCA_CONCRETE_2025,Operating seawater and unresolved interface point mass remain physical-only
windcrete_15mw,C_sensitivity,source_specified,,primary_report,2,explicit_reported_materials,2,missing_reinforcement_and_anchors,0,later_design_version_differs,0,generic_material_factors,1,yes,Unreported reinforcement and post-tensioning plus design-version change,RULE_H1,sensitivity_only,no,COREWIND_D1_3|WORLDSTEEL_PLATE_2023|MPA_GCCA_CONCRETE_2025|ICE_AGGREGATE,Reported concrete and aggregate identities are retained while missing reinforcement is stressed separately
activefloat_15mw,C_proxy,not_specified,200,secondary_public_material_table,1,rebar_unit_unresolved,0,missing_residual_and_anchors,0,mixed_associated_engineering_model,0,generic_material_factors,1,yes,The value 2550 is printed under a kg header and the material proxy has no specified depth; 200 m belongs to an associated engineering model,RULE_H1,non_headline_unresolved_unit,no,ORE_CFA_2022|COREWIND_D1_3|WORLDSTEEL_PLATE_2023|MPA_GCCA_CONCRETE_2025,The two unit readings are exclusive audit endpoints and neither is a central claim
tlp_15mw,B_conditional,source_specified,,peer_reviewed_direct_inventory,2,rope_product_to_composite_proxy,1,missing_anchors,1,single_aligned_design,2,non_product_specific_rope_factor,0,no,,RULE_H1,conditional_product_proxy,yes,FRONTIERS_TLP_2026|GOPALRAJ_CFRP_2021|WORLDSTEEL_PLATE_2023|MPA_GCCA_CONCRETE_2025,Published dry rope mass is burdened with a wide composite-product proxy bracket
